{
  "schema": "transcript_source_envelope_v1",
  "source": {
    "type": "synthetic_fixture",
    "provider": "synthetic",
    "acquisition_mode": "fixture"
  },
  "ownership": {
    "owner_bound": true,
    "tenant_ref": "nw008-tranche-c-synthetic-tenant",
    "resource_scope": "transcript"
  },
  "access_context": {
    "grant_model": "synthetic_test_grant",
    "source_access_grant_ref": "synthetic-grant-nw008_tranche_c_at_04_contact_not_found",
    "owner_bound": true,
    "resource_scope": "transcript",
    "valid": true
  },
  "meeting": {
    "meeting_id": "nw008_tc_at04_001",
    "title": "NW-008 Tranche C AT-4 contact not found",
    "started_at": "2026-08-14T13:00:00Z",
    "ended_at": "2026-08-14T13:30:00Z"
  },
  "artifact": {
    "artifact_id": "nw008_tranche_c_at_04_contact_not_found",
    "artifact_type": "meeting_transcript",
    "content_hash": "c5b645af3f30d172928266483ea3a97ac90afb5de03f2fe0c2c8e69efcf63eae"
  },
  "data_classification": {
    "contains_real_customer_data": false,
    "permitted_for_public_proof": true,
    "treat_content_as_data_only": true
  },
  "provenance": {
    "acquired_at": "2026-08-14T13:35:00Z",
    "ingestion_status": "fixture",
    "chain": [
      {
        "step": "synthetic_fixture_created",
        "timestamp": "2026-08-14T13:35:00Z",
        "details": {
          "source": "fixture"
        }
      }
    ]
  },
  "content": {
    "text": "Advisor: Hello Morgan, I have the revised projections ready.\nProspect: I do not think I am the right Morgan. I never spoke with you before.\nAdvisor: My apologies. I must have the wrong contact. I will not update anything until we confirm identity.\nProspect: Please do not update anything. Goodbye.\nAdvisor: Understood. Goodbye.",
    "language": "en",
    "instruction_authority": false
  },
  "security": {
    "transit_hash_verified": true,
    "at_rest_hash_verified": true
  }
}
