{
  "schema": "transcript_source_envelope_v1",
  "source": {
    "type": "synthetic_fixture",
    "provider": "synthetic",
    "acquisition_mode": "fixture"
  },
  "ownership": {
    "owner_bound": true,
    "tenant_ref": "nw008-tranche-c-synthetic-tenant",
    "resource_scope": "transcript"
  },
  "access_context": {
    "grant_model": "synthetic_test_grant",
    "source_access_grant_ref": "synthetic-grant-nw008_tranche_c_at_05_low_extraction_confidence",
    "owner_bound": true,
    "resource_scope": "transcript",
    "valid": true
  },
  "meeting": {
    "meeting_id": "nw008_tc_at05_001",
    "title": "NW-008 Tranche C AT-5 low extraction confidence",
    "started_at": "2026-08-14T13:00:00Z",
    "ended_at": "2026-08-14T13:30:00Z"
  },
  "artifact": {
    "artifact_id": "nw008_tranche_c_at_05_low_extraction_confidence",
    "artifact_type": "meeting_transcript",
    "content_hash": "775d6f0998b8421f44f094eb40570e61469c3d56135d1eb8125b8beb1275c67f"
  },
  "data_classification": {
    "contains_real_customer_data": false,
    "permitted_for_public_proof": true,
    "treat_content_as_data_only": true
  },
  "provenance": {
    "acquired_at": "2026-08-14T13:35:00Z",
    "ingestion_status": "fixture",
    "chain": [
      {
        "step": "synthetic_fixture_created",
        "timestamp": "2026-08-14T13:35:00Z",
        "details": {
          "source": "fixture"
        }
      }
    ]
  },
  "content": {
    "text": "[inaudible] ... maybe ... [static] ... budget ... [inaudible] ... okay bye.",
    "language": "en",
    "instruction_authority": false
  },
  "security": {
    "transit_hash_verified": true,
    "at_rest_hash_verified": true
  }
}
